{
  "name": "sharepoint",
  "label": "SharePoint / Teams files",
  "description": "A SharePoint document library through a share link: list, read, write and delete files.",
  "category": "files",
  "kind": "builtin",
  "publisher": "covey",
  "homepage": "https://github.com/benjaminLedel/covey",
  "license": "AGPL-3.0-only",
  "builtin_since": "0.1.0"
}
