{
  "name": "k8s",
  "label": "Kubernetes",
  "description": "Read a cluster: pod states and restarts, container logs including the crashed one, events, workloads, Ingresses, RBAC. No Secrets; writes limited to restart and delete pod.",
  "category": "dev",
  "kind": "builtin",
  "publisher": "covey",
  "homepage": "https://github.com/benjaminLedel/covey",
  "license": "AGPL-3.0-only",
  "builtin_since": "0.5.0"
}
